{
  "$schema": "https://json-schema.org/draft/2020-12/schema",
  "$id": "urn:bid-skills:bid-requirements:output:1.0",
  "title": "需求提取与结构化输出",
  "type": "object",
  "properties": {
    "schema_version": {
      "const": "1.0"
    },
    "skill_id": {
      "const": "bid-requirements"
    },
    "project_id": {
      "type": "string",
      "minLength": 1
    },
    "artifact_id": {
      "type": "string",
      "minLength": 1
    },
    "revision": {
      "type": "integer",
      "minimum": 1
    },
    "created_at": {
      "type": "string",
      "format": "date-time"
    },
    "status": {
      "type": "string",
      "enum": [
        "draft",
        "needs_review",
        "blocked",
        "ready"
      ]
    },
    "inputs": {
      "type": "array",
      "items": {
        "type": "object",
        "properties": {
          "artifact_id": {
            "type": "string",
            "minLength": 1
          },
          "revision": {
            "type": "integer",
            "minimum": 1
          },
          "relative_path": {
            "type": "string",
            "minLength": 1
          },
          "sha256": {
            "type": "string",
            "pattern": "^[a-f0-9]{64}$"
          }
        },
        "required": [
          "artifact_id",
          "revision",
          "relative_path",
          "sha256"
        ],
        "additionalProperties": false
      }
    },
    "summary": {
      "type": "string"
    },
    "data": {
      "type": "object",
      "properties": {
        "requirements": {
          "type": "array",
          "items": {
            "type": "object",
            "properties": {
              "id": {
                "type": "string",
                "minLength": 1
              },
              "category": {
                "type": "string",
                "enum": [
                  "technical",
                  "commercial",
                  "qualification",
                  "delivery",
                  "service",
                  "acceptance",
                  "security",
                  "other"
                ]
              },
              "text": {
                "type": "string",
                "minLength": 1
              },
              "mandatory": {
                "type": "string",
                "enum": [
                  "yes",
                  "no",
                  "unknown"
                ]
              },
              "basis_type": {
                "type": "string",
                "enum": [
                  "explicit",
                  "derived",
                  "proposal",
                  "unknown"
                ]
              },
              "conditions": {
                "type": "array",
                "items": {
                  "type": "string"
                }
              },
              "acceptance": {
                "type": [
                  "string",
                  "null"
                ]
              },
              "sources": {
                "type": "array",
                "items": {
                  "$ref": "#/$defs/source"
                }
              },
              "related_ids": {
                "type": "array",
                "items": {
                  "type": "string",
                  "minLength": 1
                }
              },
              "material_required": {
                "type": "boolean"
              }
            },
            "required": [
              "id",
              "category",
              "text",
              "mandatory",
              "basis_type",
              "conditions",
              "acceptance",
              "sources",
              "related_ids"
            ],
            "additionalProperties": false
          }
        },
        "conflicts": {
          "type": "array",
          "items": {
            "type": "object",
            "properties": {
              "id": {
                "type": "string",
                "minLength": 1
              },
              "requirement_ids": {
                "type": "array",
                "items": {
                  "type": "string",
                  "minLength": 1
                }
              },
              "description": {
                "type": "string",
                "minLength": 1
              },
              "resolution": {
                "type": [
                  "string",
                  "null"
                ]
              }
            },
            "required": [
              "id",
              "requirement_ids",
              "description",
              "resolution"
            ],
            "additionalProperties": false
          }
        },
        "unread_scopes": {
          "type": "array",
          "items": {
            "type": "string"
          }
        }
      },
      "required": [
        "requirements",
        "conflicts",
        "unread_scopes"
      ],
      "additionalProperties": false
    },
    "warnings": {
      "type": "array",
      "items": {
        "type": "string"
      }
    },
    "blockers": {
      "type": "array",
      "items": {
        "type": "string"
      }
    }
  },
  "required": [
    "schema_version",
    "skill_id",
    "project_id",
    "artifact_id",
    "revision",
    "created_at",
    "status",
    "inputs",
    "summary",
    "data",
    "warnings",
    "blockers"
  ],
  "additionalProperties": false,
  "$defs": {
    "source": {
      "type": "object",
      "properties": {
        "source_id": {
          "type": "string",
          "minLength": 1
        },
        "revision": {
          "type": "integer",
          "minimum": 1
        },
        "sha256": {
          "type": "string",
          "pattern": "^[a-f0-9]{64}$"
        },
        "location": {
          "type": "string",
          "minLength": 1
        },
        "quote": {
          "type": "string",
          "minLength": 1
        },
        "kind": {
          "type": "string",
          "enum": [
            "tender",
            "supplier",
            "official",
            "human_decision",
            "synthetic"
          ]
        }
      },
      "required": [
        "source_id",
        "revision",
        "sha256",
        "location",
        "quote",
        "kind"
      ],
      "additionalProperties": false
    }
  }
}
