{
  "schema_version": "1.0",
  "skill_id": "bid-requirements",
  "project_id": "SIM-WB-20261011",
  "artifact_id": "ART-03-REQUIREMENTS",
  "revision": 1,
  "created_at": "2026-10-10T23:15:21.925232+00:00",
  "status": "needs_review",
  "inputs": [
    {
      "artifact_id": "ART-01-NATIVE",
      "revision": 1,
      "relative_path": "artifacts/01-source-intake.json",
      "sha256": "e54a67dd19063b1f9e1345fa55cad3525f62891b1fc03b5645dc644b7852f464"
    },
    {
      "artifact_id": "ART-02-TENDER-ROUTING",
      "revision": 1,
      "relative_path": "artifacts/02-tender-routing.json",
      "sha256": "43009f353aa6b48ab2b7b9f5c59a5fe95257e82d2c09310f65dcba066adada67"
    }
  ],
  "summary": "从单一招标原件提取 12 条原子需求：R1-R6 采购需求，另含范围、实施期、质保期与三项资格/业绩材料要求；均标 explicit 并保留原文位置。",
  "data": {
    "requirements": [
      {
        "id": "REQ-R1",
        "category": "technical",
        "text": "接入既有告警平台，支持HTTPS JSON接口、告警去重与来源追溯。",
        "mandatory": "yes",
        "basis_type": "explicit",
        "conditions": [
          "须接入既有告警平台",
          "接口采用 HTTPS JSON",
          "须支持告警去重",
          "须支持来源追溯"
        ],
        "acceptance": null,
        "sources": [
          {
            "source_id": "SRC-001",
            "revision": 1,
            "sha256": "06e94c48e988157848908ff2e209df8f74a0b38c52cc60fd0331eaa3ff1018b8",
            "location": "body[6]/paragraph",
            "quote": "R1：接入既有告警平台，支持HTTPS JSON接口、告警去重与来源追溯。",
            "kind": "tender"
          }
        ],
        "related_ids": [],
        "material_required": false
      },
      {
        "id": "REQ-R2",
        "category": "technical",
        "text": "提供事件登记、工单派发、接单、处置、复核、归档六个状态；复核不通过须退回处置并保留日志。",
        "mandatory": "yes",
        "basis_type": "explicit",
        "conditions": [
          "须覆盖登记/派发/接单/处置/复核/归档六个状态",
          "复核不通过须退回处置",
          "退回须保留日志"
        ],
        "acceptance": null,
        "sources": [
          {
            "source_id": "SRC-001",
            "revision": 1,
            "sha256": "06e94c48e988157848908ff2e209df8f74a0b38c52cc60fd0331eaa3ff1018b8",
            "location": "body[7]/paragraph",
            "quote": "R2：提供事件登记、工单派发、接单、处置、复核、归档六个状态；复核不通过须退回处置并保留日志。",
            "kind": "tender"
          }
        ],
        "related_ids": [],
        "material_required": false
      },
      {
        "id": "REQ-R3",
        "category": "security",
        "text": "实现管理员、调度员、处置人员三类角色和最小权限控制；操作审计日志保留不少于180天。",
        "mandatory": "yes",
        "basis_type": "explicit",
        "conditions": [
          "三类角色",
          "最小权限控制",
          "审计日志保留不少于180天"
        ],
        "acceptance": null,
        "sources": [
          {
            "source_id": "SRC-001",
            "revision": 1,
            "sha256": "06e94c48e988157848908ff2e209df8f74a0b38c52cc60fd0331eaa3ff1018b8",
            "location": "body[8]/paragraph",
            "quote": "R3：实现管理员、调度员、处置人员三类角色和最小权限控制；操作审计日志保留不少于180天。",
            "kind": "tender"
          }
        ],
        "related_ids": [],
        "material_required": false
      },
      {
        "id": "REQ-R4",
        "category": "technical",
        "text": "提供事件列表、超时预警、闭环率统计和按时间导出功能。",
        "mandatory": "yes",
        "basis_type": "explicit",
        "conditions": [
          "事件列表",
          "超时预警",
          "闭环率统计",
          "按时间导出"
        ],
        "acceptance": null,
        "sources": [
          {
            "source_id": "SRC-001",
            "revision": 1,
            "sha256": "06e94c48e988157848908ff2e209df8f74a0b38c52cc60fd0331eaa3ff1018b8",
            "location": "body[9]/paragraph",
            "quote": "R4：提供事件列表、超时预警、闭环率统计和按时间导出功能。",
            "kind": "tender"
          }
        ],
        "related_ids": [],
        "material_required": false
      },
      {
        "id": "REQ-R5",
        "category": "acceptance",
        "text": "验收至少包含接口联调、状态流转、权限隔离、异常恢复四类测试，提供用例与结果。",
        "mandatory": "yes",
        "basis_type": "explicit",
        "conditions": [
          "四类测试：接口联调/状态流转/权限隔离/异常恢复",
          "须提供用例与结果"
        ],
        "acceptance": "四类测试的用例与结果随验收提交",
        "sources": [
          {
            "source_id": "SRC-001",
            "revision": 1,
            "sha256": "06e94c48e988157848908ff2e209df8f74a0b38c52cc60fd0331eaa3ff1018b8",
            "location": "body[10]/paragraph",
            "quote": "R5：验收至少包含接口联调、状态流转、权限隔离、异常恢复四类测试，提供用例与结果。",
            "kind": "tender"
          }
        ],
        "related_ids": [],
        "material_required": false
      },
      {
        "id": "REQ-R6",
        "category": "service",
        "text": "工作日服务，故障2小时内响应，24小时内提供处置计划；该时限须在响应文件承诺并有资源依据。",
        "mandatory": "yes",
        "basis_type": "explicit",
        "conditions": [
          "工作日服务",
          "故障 2 小时内响应",
          "24 小时内提供处置计划",
          "须在响应文件承诺并有资源依据"
        ],
        "acceptance": null,
        "sources": [
          {
            "source_id": "SRC-001",
            "revision": 1,
            "sha256": "06e94c48e988157848908ff2e209df8f74a0b38c52cc60fd0331eaa3ff1018b8",
            "location": "body[11]/paragraph",
            "quote": "R6：工作日服务，故障2小时内响应，24小时内提供处置计划；该时限须在响应文件承诺并有资源依据。",
            "kind": "tender"
          }
        ],
        "related_ids": [],
        "material_required": false
      },
      {
        "id": "REQ-SCOPE-1",
        "category": "delivery",
        "text": "交付范围为软件集成及一年运维服务，不含硬件供货和土建。",
        "mandatory": "yes",
        "basis_type": "explicit",
        "conditions": [
          "单一标包",
          "不含硬件供货",
          "不含土建"
        ],
        "acceptance": null,
        "sources": [
          {
            "source_id": "SRC-001",
            "revision": 1,
            "sha256": "06e94c48e988157848908ff2e209df8f74a0b38c52cc60fd0331eaa3ff1018b8",
            "location": "body[2]/paragraph",
            "quote": "单一标包，内容为软件集成及一年运维服务，不含硬件供货和土建",
            "kind": "tender"
          }
        ],
        "related_ids": [],
        "material_required": false
      },
      {
        "id": "REQ-PERIOD-1",
        "category": "delivery",
        "text": "实施期为合同签订后60个日历日。",
        "mandatory": "yes",
        "basis_type": "explicit",
        "conditions": [
          "合同签订后 60 个日历日"
        ],
        "acceptance": null,
        "sources": [
          {
            "source_id": "SRC-001",
            "revision": 1,
            "sha256": "06e94c48e988157848908ff2e209df8f74a0b38c52cc60fd0331eaa3ff1018b8",
            "location": "body[4]/paragraph",
            "quote": "实施期：合同签订后60个日历日",
            "kind": "tender"
          }
        ],
        "related_ids": [],
        "material_required": false
      },
      {
        "id": "REQ-WARRANTY-1",
        "category": "service",
        "text": "质保及运维期为验收后12个月。",
        "mandatory": "yes",
        "basis_type": "explicit",
        "conditions": [
          "验收后 12 个月"
        ],
        "acceptance": null,
        "sources": [
          {
            "source_id": "SRC-001",
            "revision": 1,
            "sha256": "06e94c48e988157848908ff2e209df8f74a0b38c52cc60fd0331eaa3ff1018b8",
            "location": "body[4]/paragraph",
            "quote": "质保及运维：验收后12个月",
            "kind": "tender"
          }
        ],
        "related_ids": [],
        "material_required": false
      },
      {
        "id": "REQ-CERT-1",
        "category": "qualification",
        "text": "须提供有效营业执照复印件，缺失则资格审查不通过。",
        "mandatory": "yes",
        "basis_type": "explicit",
        "conditions": [
          "有效营业执照复印件"
        ],
        "acceptance": null,
        "sources": [
          {
            "source_id": "SRC-001",
            "revision": 1,
            "sha256": "06e94c48e988157848908ff2e209df8f74a0b38c52cc60fd0331eaa3ff1018b8",
            "location": "body[19]/paragraph",
            "quote": "Q1须提供有效营业执照复印件；缺失则资格审查不通过",
            "kind": "tender"
          }
        ],
        "related_ids": [],
        "material_required": true
      },
      {
        "id": "REQ-SIGN-1",
        "category": "qualification",
        "text": "投标函须有签署及盖章，缺失则否决。",
        "mandatory": "yes",
        "basis_type": "explicit",
        "conditions": [
          "投标函签署",
          "投标函盖章"
        ],
        "acceptance": null,
        "sources": [
          {
            "source_id": "SRC-001",
            "revision": 1,
            "sha256": "06e94c48e988157848908ff2e209df8f74a0b38c52cc60fd0331eaa3ff1018b8",
            "location": "body[19]/paragraph",
            "quote": "Q2投标函须有签署及盖章；缺失则否决",
            "kind": "tender"
          }
        ],
        "related_ids": [],
        "material_required": true
      },
      {
        "id": "REQ-PERF-1",
        "category": "qualification",
        "text": "提供一份软件平台集成合同复印件及验收证明，两者齐备计10分，否则0分。",
        "mandatory": "yes",
        "basis_type": "explicit",
        "conditions": [
          "软件平台集成合同复印件",
          "验收证明",
          "两者齐备方计分"
        ],
        "acceptance": null,
        "sources": [
          {
            "source_id": "SRC-001",
            "revision": 1,
            "sha256": "06e94c48e988157848908ff2e209df8f74a0b38c52cc60fd0331eaa3ff1018b8",
            "location": "body[17]/paragraph",
            "quote": "S5类似业绩10分：提供一份软件平台集成合同复印件及验收证明，两者齐备计10分，否则0分",
            "kind": "tender"
          }
        ],
        "related_ids": [],
        "material_required": true
      }
    ],
    "conflicts": [],
    "unread_scopes": [
      "DOCX 文本框、修订、批注与复杂合并表未经渲染复核；本原件为纯段落结构，未发现表格。",
      "未提供附件、澄清、补遗或图纸文件。"
    ]
  },
  "warnings": [
    "DOCX 原生提取不保证文本框、修订、批注及复杂合并表完整，需复核。"
  ],
  "blockers": []
}
